{
  "stance": "amend",
  "target_schema": "silver",
  "target_table": "silver_invoice_lines",
  "proposed_version": "1.3.0",
  "columns": [
    {
      "name": "invoice_id",
      "logical_type": "string",
      "physical_type": "VARCHAR",
      "required": true,
      "description": "Invoice number, kept as text (identifiers are text; Session D rule). A leading C marks a cancellation invoice; see is_cancellation.",
      "rationale": "Fresh profile shows null_rate 0.0 and distinct_count 2330 over 44,721 rows, unchanged from the committed contract's basis; no change declared."
    },
    {
      "name": "is_cancellation",
      "logical_type": "boolean",
      "physical_type": "BOOLEAN",
      "required": true,
      "description": "True when invoice_id carries the C cancellation prefix. Decision: cancellations are retained and flagged, not dropped, so conservation arithmetic against bronze stays auditable; exclusion is a consumer decision made at the mapping contract, not silently here.",
      "rationale": "Fresh profile shows null_rate 0.0, distinct_count 2 (false, true); matches committed contract, no change declared."
    },
    {
      "name": "stock_code",
      "logical_type": "string",
      "physical_type": "VARCHAR",
      "required": true,
      "description": "Product code as landed, kept as text; alphanumeric suffixes and non-product adjustment codes (for example POST, M) occur.",
      "rationale": "Fresh profile shows null_rate 0.0 and distinct_count 3141; unchanged from committed basis, no change declared."
    },
    {
      "name": "product_description",
      "logical_type": "string",
      "physical_type": "VARCHAR",
      "required": false,
      "description": "Product description, whitespace-trimmed. Null rate 0.005041 at profile v0001; nulls retained rather than imputed.",
      "rationale": "Fresh profile measures null_rate 0.005098 (228 of 44,721 rows), still nonzero, so required stays false; no change declared."
    },
    {
      "name": "quantity",
      "logical_type": "integer",
      "physical_type": "INTEGER",
      "required": true,
      "description": "Units on the line, cast from DECIMAL(38,9) to INTEGER. Negative values occur both on cancellation-invoice lines and on zero-unit-price stock-adjustment lines; consumers must not infer cancellation from negative quantity alone.",
      "rationale": "Fresh profile shows null_rate 0.0, min -1395, max 5184; unchanged from committed basis, no change declared."
    },
    {
      "name": "invoiced_at",
      "logical_type": "date",
      "physical_type": "TIMESTAMP",
      "required": true,
      "description": "Invoice timestamp. Decision: strict cast from the VARCHAR landing (\"YYYY-MM-DD HH:MM:SS\"); an unparseable value fails the build loudly rather than becoming a silent null. On within-invoice clock-drift duplicates the earliest scan tick wins (min).",
      "rationale": "Fresh profile shows null_rate 0.0, min 2009-12-01T07:45:00, max 2009-12-23T16:58:00; unchanged from committed basis, no change declared."
    },
    {
      "name": "unit_price",
      "logical_type": "number",
      "physical_type": "DECIMAL(10,2)",
      "required": true,
      "description": "Unit price in sterling, cast from DECIMAL(38,9). Observed range 0.00 to 1998.49 at v0001. Decision: zero-price lines (freebies and adjustments) are retained; negative prices are contract-invalid.",
      "rationale": "Fresh profile shows null_rate 0.0, min 0.0, max 1998.49; unchanged from committed basis, no change declared."
    },
    {
      "name": "customer_id",
      "logical_type": "integer",
      "physical_type": "INTEGER",
      "required": false,
      "description": "Customer identifier, cast DECIMAL(38,9) to INTEGER (integral min, max, and samples, 12346 to 18287 at v0001). Decision: the 0.29778 bronze null rate is retained as null (guest or unregistered checkouts), not dropped and not imputed.",
      "rationale": "Fresh profile measures null_rate 0.300664 (13,446 of 44,721 rows), still nonzero, so required stays false; no change declared."
    },
    {
      "name": "country",
      "logical_type": "string",
      "physical_type": "VARCHAR",
      "required": true,
      "description": "Customer country as landed (24 distinct at v0001).",
      "rationale": "Fresh profile shows null_rate 0.0, distinct_count 24; unchanged from committed basis, no change declared."
    },
    {
      "name": "captured_at",
      "logical_type": "date",
      "physical_type": "TIMESTAMP",
      "required": true,
      "description": "Capture timestamp carried forward from the bronze landing, marking when the surviving line's earliest capture entered the pipeline. It is the incremental watermark the gold layer builds on and is required because the incremental path is now live and every row is guaranteed a capture time.",
      "rationale": "Fresh profile measures null_rate 0.0 for captured_at over 44,721 rows, confirming the declared follow-up: the incremental path has landed and the column is fully populated, so required moves from false to true."
    }
  ],
  "grain_keys": [
    "invoice_id",
    "stock_code",
    "quantity",
    "unit_price"
  ],
  "quality_rules": [
    {
      "kind": "row_count_positive",
      "column": "",
      "values": [],
      "rationale": "Fresh profile measures row_count 44,721, confirming the table is never empty."
    },
    {
      "kind": "grain_unique",
      "column": "",
      "values": [],
      "rationale": "Grain (invoice_id, stock_code, quantity, unit_price) remains the declared uniqueness key; no grain change is proposed in this amendment."
    },
    {
      "kind": "non_negative",
      "column": "unit_price",
      "values": [],
      "rationale": "Fresh profile measures unit_price min 0.0 with no negative values across 44,721 rows, consistent with the committed non-negative rule."
    }
  ],
  "changes": [
    {
      "kind": "required_change",
      "column": "captured_at",
      "before": "false",
      "after": "true",
      "rationale": "Fresh profile measures null_rate 0.0 for captured_at over 44,721 rows; the incremental path has landed as the committed contract's declared follow-up anticipated, so required tightens from false to true."
    },
    {
      "kind": "description_change",
      "column": "captured_at",
      "before": "Capture timestamp carried forward from the bronze landing (_airbyte_extracted_at): when the surviving line's earliest capture entered the pipeline. The incremental watermark the gold layer builds on (Record 008 part two, D-38). Enters optional under the F-28 rule; the declared follow-up tightens it to required once the incremental path lands and the column is proven populated. v1.2.0 adds this column and changes nothing else.",
      "after": "Capture timestamp carried forward from the bronze landing, marking when the surviving line's earliest capture entered the pipeline. It is the incremental watermark the gold layer builds on and is required because the incremental path is now live and every row is guaranteed a capture time.",
      "rationale": "The operator intent states the incremental path has landed and the fresh profile confirms null_rate 0.0 over 44,721 rows, so the description now states the column is required rather than describing it as pending the F-28 follow-up."
    }
  ],
  "decisions": [
    {
      "key": "decisionCapturedAtRequired",
      "value": "required-after-incremental-landing",
      "rationale": "Fresh profile measures captured_at null_rate 0.0 over 44,721 rows, confirming the incremental path has landed and the column is fully populated, justifying the move from optional to required."
    }
  ],
  "purpose": "The cleaned, typed, one-row-per-invoice-line view of the Online Retail II sample: the first contracted silver table and the sole silver input to the gold unified event star.",
  "usage": "Read silver.silver_invoice_lines for line-level retail sales analysis. Cancellation lines are retained and flagged (is_cancellation); consumers aggregating revenue must filter or net them deliberately. Zero-price lines are retained.",
  "limitations": "Exact duplicate bronze rows are treated as capture artifacts and excluded, so identical legitimate re-scans are indistinguishable and also excluded; the residual grain is the distinct line. Rows identical in every business column except invoicedate are the same capture artifact seen across a register clock tick; they collapse to one line and the earliest timestamp is retained. customer_id remains nullable for guest or unregistered checkouts and is retained with customer_id null."
}
